{
  "$schema": "https://json-schema.org/draft/2020-12/schema",
  "title": "ACX context v0.1",
  "type": "object",
  "additionalProperties": false,
  "required": [
    "acx_version",
    "id",
    "kind",
    "entries"
  ],
  "properties": {
    "acx_version": {
      "const": "0.1.0"
    },
    "id": {
      "type": "string",
      "minLength": 1
    },
    "kind": {
      "const": "context"
    },
    "entries": {
      "type": "array",
      "items": {
        "$ref": "#/$defs/entry"
      }
    }
  },
  "$defs": {
    "entry": {
      "type": "object",
      "additionalProperties": false,
      "required": [
        "id",
        "kind",
        "content"
      ],
      "properties": {
        "id": {
          "type": "string",
          "minLength": 1
        },
        "kind": {
          "enum": [
            "instruction",
            "memory",
            "skill"
          ]
        },
        "key": {
          "type": "string",
          "minLength": 1
        },
        "content": {
          "type": "string",
          "minLength": 1
        },
        "scope": {
          "type": "object",
          "additionalProperties": false,
          "properties": {
            "tasks": {
              "type": "array",
              "items": {
                "type": "string"
              }
            },
            "paths": {
              "type": "array",
              "items": {
                "type": "string"
              }
            }
          }
        },
        "source": {
          "type": "object",
          "additionalProperties": false,
          "required": [
            "type"
          ],
          "properties": {
            "type": {
              "enum": [
                "repository",
                "file",
                "user"
              ]
            },
            "path": {
              "type": "string"
            }
          }
        },
        "expires_at": {
          "type": [
            "string",
            "null"
          ],
          "format": "date-time"
        }
      }
    }
  }
}
